{"schema_version":"1.0","environment_id":"env_synthetic_node","os":"recorded-at-run","runtime":"Node >=20","cpu":"recorded-at-run","gpu":null,"ram_bytes":1,"dependency_lock_hash":"sha256:de9454680ac1930cef31e06948278cbee104f044d3e64ca0c35a894367ce6b09","code_evidence_hash":"sha256:c9716ee50c8e1f3dceae95b5611fe042207f5acdf4968ea63f21e23f341fc4c5","locale":"en-GB","timezone":"Europe/London","permitted_secret_identifiers":[]}
